{
  "schema": "cauce.operation/1",
  "id": "regenerate.spatial",
  "version": 1,
  "title": "Regenerate spatial detail with the same H3 model",
  "kind": "h3-inference",
  "implementation_class": "official-h3-with-cauce-primitives",
  "summary": "Increase spatial resolution through a partial-denoise second H3 pass using either resized native visual state or frames re-encoded by the H3 VAE; optional overlapping tiles bound VRAM without introducing a dedicated restoration model.",
  "inputs": [
    { "name": "source_native_av_latent", "type": "LATENT", "required": true },
    { "name": "source_frames", "type": "IMAGE", "required": false },
    { "name": "prompt", "type": "STRING", "required": true },
    { "name": "target_width", "type": "INT", "required": true },
    { "name": "target_height", "type": "INT", "required": true },
    { "name": "video_denoise", "type": "FLOAT", "required": true },
    { "name": "generation_config", "type": "CAUCE_H3_GENERATION_BINDINGS", "required": true }
  ],
  "outputs": [
    { "name": "regenerated_native_av_latent", "type": "LATENT", "required": true },
    { "name": "regenerated_frames", "type": "IMAGE", "required": true }
  ],
  "constraints": {
    "frame_rate": 24,
    "frame_count_rule": "unchanged 17k+5",
    "target_dimensions_multiple": 32,
    "same_h3_checkpoint": true,
    "special_upscaler_model": false,
    "audio_default_denoise": 0.0,
    "conditioning_rebuilt_at_target_geometry": true,
    "sampler_patch": false
  },
  "graph_contract": [
    { "order": 1, "owner": "cauce", "node_type": "CauceH3InspectAVLatent", "role": "validate source native AV state and unchanged duration" },
    { "order": 2, "owner": "cauce", "node_type": "CauceH3ResizeAVLatent", "role": "resize native visual state for the latent-hires variant", "optional": true },
    { "order": 3, "owner": "cauce", "node_type": "CauceH3ReplaceVisualStream", "role": "graft H3-VAE re-encoded high-resolution frames for pixel/VAE variants", "optional": true },
    { "order": 4, "owner": "official-comfy", "node_type": "MiniMaxH3ImageToVideo", "role": "rebuild official H3 conditioning at target geometry" },
    { "order": 5, "owner": "official-comfy", "node_type": "MiniMaxH3SigmaShift", "role": "apply explicit H3 flow shifts" },
    { "order": 6, "owner": "vanilla-comfy", "node_type": "SamplerCustomAdvanced", "role": "run the bounded same-H3 regeneration pass" },
    { "order": 7, "owner": "cauce", "node_type": "CauceH3ClearAVDenoiseMask", "role": "clear consumed mask metadata" },
    { "order": 8, "owner": "vanilla-comfy", "node_type": "VAEDecode", "role": "decode regenerated frames" }
  ],
  "variants": [
    { "id": "latent-second-pass", "initial_state": "bicubic-resized-H3-visual-latent" },
    { "id": "pixel-vae-second-pass", "initial_state": "pixel-upscale-then-H3-VAE-encode" },
    { "id": "tiled-pixel-vae", "initial_state": "overlapping-pixel-tiles-then-H3-VAE-encode", "experimental": true }
  ],
  "artifacts": { "state": "contract-only", "pairs": [] },
  "evidence": {
    "level": "unit-validated",
    "visual_verdict": "unassessed",
    "summary": "Spatial-only latent resize, H3-VAE visual-stream graft, unchanged duration, and separate video/audio denoise masks are unit-validated; useful denoise ranges and 5090 memory limits remain live gates."
  }
}
