{
  "schema": "cauce.operation/1",
  "id": "generate.with_control",
  "version": 1,
  "title": "Generate with structural video control",
  "kind": "h3-inference",
  "implementation_class": "official-comfy-with-cauce-planning",
  "summary": "Apply the official MiniMax H3 Fun Control model patch to a target generated by H3 while CAUCE exposes clip fitting and packed-sequence cost without changing model behavior.",
  "inputs": [
    { "name": "prompt", "type": "STRING", "required": true },
    { "name": "control_video", "type": "IMAGE", "required": false, "cardinality": "24 fps structural frames" },
    { "name": "source_video", "type": "IMAGE", "required": false, "cardinality": "24 fps source behind an inpaint mask" },
    { "name": "mask", "type": "MASK", "required": false, "cardinality": "one or more spatial masks; 1 regenerates" },
    { "name": "references", "type": "CAUCE_REFERENCE_SET", "required": false },
    { "name": "control_strength", "type": "FLOAT", "required": true },
    { "name": "control_start_percent", "type": "FLOAT", "required": true },
    { "name": "control_end_percent", "type": "FLOAT", "required": true },
    { "name": "generation_config", "type": "CAUCE_H3_GENERATION_BINDINGS", "required": true }
  ],
  "outputs": [
    { "name": "generated_frames", "type": "IMAGE", "required": true },
    { "name": "native_av_latent", "type": "LATENT", "required": true }
  ],
  "constraints": {
    "frame_rate": 24,
    "frame_count_rule": "17k+5",
    "official_control_node": "MiniMaxH3FunControlNetApply",
    "official_patch_loader": "ModelPatchLoader",
    "control_fit_rule": "truncate tail or repeat final frame; bilinear resize and center crop",
    "mask_threshold_in_current_core": 0.5,
    "control_plus_references_gate": "Comfy-Org/ComfyUI#16020 or equivalent merged behavior",
    "denoise_mask_velocity_gate": "Comfy-Org/ComfyUI#15988 or equivalent merged behavior",
    "fixed_soundtrack_conditioning": false
  },
  "graph_contract": [
    { "order": 1, "owner": "official-comfy", "node_type": "MiniMaxH3ImageToVideo", "role": "create prompt conditioning and the target packed AV latent for non-reference variants", "optional": true },
    { "order": 2, "owner": "official-comfy", "node_type": "MiniMaxH3ReferenceToVideo", "role": "create reference conditioning and the target packed AV latent for the gated reference-control variant", "optional": true },
    { "order": 3, "owner": "cauce", "node_type": "CauceH3PlanControlClip", "role": "report exact temporal and spatial fitting before applying control" },
    { "order": 4, "owner": "vanilla-comfy", "node_type": "ModelPatchLoader", "role": "load the official H3 Fun Control union patch" },
    { "order": 5, "owner": "official-comfy", "node_type": "MiniMaxH3FunControlNetApply", "role": "attach structural control, inpaint source/mask, strength, and sampling interval to the H3 model" },
    { "order": 6, "owner": "cauce", "node_type": "CauceH3InspectPackedSequence", "role": "report the exact multimodal attention row count before sampling" },
    { "order": 7, "owner": "vanilla-comfy", "node_type": "SamplerCustomAdvanced", "role": "sample the controlled target" },
    { "order": 8, "owner": "vanilla-comfy", "node_type": "VAEDecode", "role": "decode visual frames" }
  ],
  "variants": [
    { "id": "structural-video", "control_kinds": ["canny", "depth", "pose", "hed", "mlsd", "arbitrary-precomputed"] },
    { "id": "masked-inpaint", "mask_semantics": "1 regenerates; current official implementation thresholds at 0.5" },
    { "id": "reference-control", "experimental": true, "requires_upstream_gate": "Comfy-Org/ComfyUI#16020" }
  ],
  "artifacts": { "state": "contract-only", "pairs": [] },
  "evidence": {
    "level": "defined",
    "visual_verdict": "unassessed",
    "summary": "Official control support is merged in ComfyUI; this contract remains offline until the laboratory runtime exposes the node, patch weights, and required upstream fixes."
  }
}
