{
  "schema": "cauce.operation/1",
  "id": "continue.native_av",
  "version": 3,
  "title": "Continue native H3 audiovisual state",
  "kind": "h3-inference",
  "implementation_class": "official-h3-with-cauce-primitives",
  "summary": "Extend cumulative packed H3 AV state through an absolute overlap window, optionally preserving the overlap with the official per-token mask path and adding a future decoded guide.",
  "inputs": [
    { "name": "source_native_av_latent", "type": "LATENT", "required": true, "cardinality": "one packed cumulative H3 AV latent" },
    { "name": "prompt", "type": "STRING", "required": true },
    { "name": "overlap_frames", "type": "INT", "required": true },
    { "name": "extension_frames", "type": "INT", "required": true },
    { "name": "future_guide", "type": "IMAGE", "required": false, "cardinality": "one image or one legal 17k+5 clip" },
    { "name": "generation_config", "type": "CAUCE_H3_GENERATION_BINDINGS", "required": true }
  ],
  "outputs": [
    { "name": "continued_native_av_latent", "type": "LATENT", "required": true, "cardinality": "source plus one globally contiguous AV suffix" },
    { "name": "generated_suffix", "type": "CAUCE_H3_AV_SPAN", "required": true },
    { "name": "continued_frames", "type": "IMAGE", "required": false, "cardinality": "decoded cumulative latent" }
  ],
  "constraints": {
    "frame_rate": 24,
    "frame_count_rule": "17k+5",
    "default_overlap_frames": 22,
    "default_extension_frames": 119,
    "default_window_frames": 141,
    "absolute_audio_clock_hz": 40,
    "mask_semantics": "1 generates, 0 preserves",
    "minimum_comfyui_core_commit": "ff6c8a8af144fc9e9e7bc436b1b202f9316848d8",
    "fixed_soundtrack_conditioning": false,
    "sampler_patch": false
  },
  "graph_contract": [
    { "order": 1, "owner": "cauce", "node_type": "CauceH3InspectAVLatent", "role": "validate cumulative packed AV geometry" },
    { "order": 2, "owner": "cauce", "node_type": "CauceH3PlanAVWindow", "role": "resolve the overlap and extension on absolute visual and structural-audio clocks" },
    { "order": 3, "owner": "cauce", "node_type": "CauceH3AllocateAVWindow", "role": "allocate the fresh absolute target window" },
    { "order": 4, "owner": "cauce", "node_type": "CauceH3ExtractAVSpan", "role": "extract the synchronized source tail" },
    { "order": 5, "owner": "cauce", "node_type": "CauceH3PlaceAVSpan", "role": "copy the source tail into the target overlap", "optional": true },
    { "order": 6, "owner": "cauce", "node_type": "CauceH3SetAVDenoiseInterval", "role": "preserve the overlap and generate only the suffix", "optional": true },
    { "order": 7, "owner": "official-comfy", "node_type": "MiniMaxH3ImageToVideo", "role": "create prompt conditioning for the planned window" },
    { "order": 8, "owner": "cauce", "node_type": "CauceH3AddAVSpanGuide", "role": "optionally expose the overlap as native H3 keyframe conditioning", "optional": true },
    { "order": 9, "owner": "official-comfy", "node_type": "MiniMaxH3AddGuide", "role": "optionally anchor a decoded future image or clip inside the extension", "optional": true },
    { "order": 10, "owner": "vanilla-comfy", "node_type": null, "role": "sample the target with the ordinary official path" },
    { "order": 11, "owner": "cauce", "node_type": "CauceH3ExtractAVSpan", "role": "extract only the explicit generated suffix" },
    { "order": 12, "owner": "cauce", "node_type": "CauceH3AppendAVSpan", "role": "append the globally contiguous suffix to cumulative state" },
    { "order": 13, "owner": "cauce", "node_type": "CauceSaveAVLatent", "role": "persist cumulative native state for later continuation", "optional": true }
  ],
  "variants": [
    { "id": "keyframe-overlap", "overlap_transport": "minimax_keyframes", "future_guide": false },
    { "id": "masked-overlap", "overlap_transport": "noise_mask", "future_guide": false },
    { "id": "masked-overlap-future-guide", "overlap_transport": "noise_mask", "future_guide": true }
  ],
  "artifacts": { "state": "contract-only", "pairs": [] },
  "evidence": {
    "level": "unit-validated",
    "visual_verdict": "unassessed",
    "summary": "Absolute AV span mechanics and continuous mask construction are unit-validated. The native-keyframe path has a synthetic live smoke; masked variants require live schema and visual validation."
  }
}
