{
  "schema": "cauce.operation/1",
  "id": "reference.transform",
  "version": 1,
  "title": "Transform decoded media into an H3 reference",
  "kind": "decoded-media-transform",
  "implementation_class": "cauce-and-vanilla-deterministic",
  "summary": "Construct inspectable decoded reference media with deterministic coordinate maps for later official H3 reference or guide conditioning.",
  "inputs": [
    { "name": "source_frames", "type": "IMAGE", "required": true, "cardinality": "one image or frame batch" },
    { "name": "coordinate_maps", "type": "CAUCE_MAP", "required": true, "cardinality": "one or more maps" },
    { "name": "spatial_mask", "type": "MASK", "required": false }
  ],
  "outputs": [
    { "name": "reference_clip", "type": "IMAGE", "required": true, "cardinality": "one inspectable frame batch" },
    { "name": "validity_mask", "type": "MASK", "required": false, "cardinality": "one mask per generated reference frame" }
  ],
  "constraints": {
    "single_final_resampling": true,
    "reference_must_be_inspected_before_h3": true,
    "direct_h3_latent_warp": false
  },
  "graph_contract": [
    { "order": 1, "owner": "cauce", "node_type": null, "role": "build one or more deterministic CAUCE_MAP values", "repeatable": true },
    { "order": 2, "owner": "cauce", "node_type": "CauceComposeMotionMaps", "role": "compose coordinate pullbacks before image sampling", "optional": true },
    { "order": 3, "owner": "cauce", "node_type": "CauceWarpImage", "role": "sample source media once to produce the decoded reference clip" }
  ],
  "variants": [
    { "id": "affine", "map_node": "CauceAffineMotionMap" },
    { "id": "perspective", "map_node": "CaucePerspectiveMotionMap" },
    { "id": "depth-camera", "map_node": "CauceDepthCameraMotionMap" },
    { "id": "external-displacement", "map_node": "CauceDisplacementMotionMap" },
    { "id": "advection", "map_node": "CauceIntegrateAdvection" }
  ],
  "artifacts": {
    "state": "contract-only",
    "pairs": []
  },
  "evidence": {
    "level": "unit-validated",
    "visual_verdict": "unassessed",
    "summary": "Coordinate-map algebra and decoded image warping are unit-validated; H3 motion correspondence remains uncharacterized."
  }
}
